Source,DocumentID,Price,BoatLocation,MakeString,ModelYear,Model,BeamMeasure,TotalEnginePowerQuantity,NominalLength,LengthOverall,Engines,GeneralBoatDescription,AdditionalDetailDescription,Images,Link
inventory,9894188,105000.00 USD,"{'BoatCityName': 'Key West', 'BoatCountryID': 'US', 'BoatStateCode': 'FL'}",Intrepid,2009,323 CC,9.5 ft,600 hp,32 ft,32 ft,"[{'Make': 'Mercury', 'Model': '13000076A', 'DriveTransmissionDescription': 'Stern', 'Fuel': 'unleaded', 'EnginePower': '300|horsepower', 'Type': 'Outboard', 'PropellerType': '4 Blade, Stainless Steel', 'Year': 2019, 'Hours': 915, 'BoatEngineLocationCode': 'Port'}, {'Make': 'Mercury', 'Model': '13000068A', 'DriveTransmissionDescription': 'Stern', 'Fuel': 'unleaded', 'EnginePower': '300|horsepower', 'Type': 'Outboard', 'PropellerType': '4 Blade, Stainless Steel', 'Year': 2019, 'Hours': 915, 'BoatEngineLocationCode': 'Starboard'}]","['2009 Intrepid 323 Center Console – Repowered with Mercury 300 V8s – Loaded and Located in Key WestThis 2009 Intrepid 323 Center Console, located in Key West, FL, is a powerful, turn-key vessel that’s been professionally maintained and thoughtfully upgraded. Repowered in 2019 with twin Mercury 300 V8 Verados, this boat combines Intrepid’s renowned ride quality with modern performance and reliability.With 915 hours on the motors and a comprehensive electronics and equipment package, this 323 CC is built for offshore adventure, island hopping, or stylish coastal cruising.Key Features & Highlights: Twin 2019 Mercury 300 V8 Verados – 915 hours, well maintained Garmin electronics suite with twin GPSMAP 7612 displays Garmin xHD2 open-array radar for superior target tracking Molded transom livewell for serious fishing functionality Fusion stereo system with premium sound Trim tabs for enhanced ride control Precision Marine onboard battery charger Brand new head system in console Intrepid’s high-performance stepped hull Spacious forward seating with storage Fold-down aft bench for versatile cockpit space Dive door and integrated swim platform with ladder Fiberglass hardtop with integrated lighting and rod holdersThis vessel is an ideal choice for anyone looking for a high-quality center console that’s already been repowered and updated with premium gear. Intrepid\'s build quality and attention to detail make this boat stand out in its class.']","['listingThe Company offers the details of this vessel in good faith but cannot guarantee or warrant the accuracy of this information nor warrant the condition of the vessel. A buyer should instruct his agents, or his surveyors, to investigate such details as the buyer desires validated. This vessel is offered subject to prior sale, price change, or withdrawal without notice.']","{'Priority': '0', 'Caption': 'Profile', 'Uri': 'https://images.boatsgroup.com/images/1/41/88/2009-intrepid-323-cc-power-9894188-20250802142423405-0.jpg', 'LastModifiedDateTime': '2025-08-02T14:24:24-08:00'}",https://development.jupitermarinesales.com/search-listing/9894188
service,9964775,1499999.00 USD,"{'BoatCityName': 'Miami', 'BoatCountryID': 'US', 'BoatStateCode': 'FL'}",Azimut,2020,60 fly,16.58 ft,"1,800 hp",60 ft,60 ft,"[{'Make': 'Volvo', 'Model': 'D13', 'Fuel': 'diesel', 'EnginePower': '900|horsepower', 'Type': 'Inboard', 'Year': 2020, 'Hours': 800, 'BoatEngineLocationCode': 'Port'}, {'Make': 'Volvo', 'Model': 'D13', 'Fuel': 'diesel', 'EnginePower': '900|horsepower', 'Type': 'Inboard', 'Year': 2020, 'Hours': 800, 'BoatEngineLocationCode': 'Starboard'}]","['2020 Azimut 60 Fly\xa0Located in Miami, this 2020 Azimut 60 Fly combines performance, Italian design, and modern technology into one of the most popular flybridge yachts in its class. With only 800 hours on her twin Volvo D13 900 shaft drive engines, she is fully equipped and well maintained, offering the perfect platform for family cruising or entertaining on the water.PerformanceCruising speed: 25 knotsTop speed: 30 knotsHighlights & Features Twin Volvo Penta D13 900 HP engines with 800hrs Three cabins with two heads plus crew quarter layout Raymarine electronic package with redundancy at the flybridge helm Starlink + SAT TV for seamless connectivity and entertainment Upgraded JL Audio sound system throughout Wine cooler and electric high-low table in the salon Electric cockpit privacy shade Full wet bar on the flybridge Modular seating layout on the flybridgeService & Maintenance All services up to date Generator serviced May – 2025 Bottom paint completed January – 2025 Seakeeper serviced June – 2025 Engines serviced June – 2025 New bottom paint completed – October 2025 New PropSpeed applied to running gear and swim platform brackets – October 2025 All zinc anodes replaced – October 2025 New Seakeeper thru-hull valve installed – October 2025 Toilet system serviced – October 2025 New engine blowers installed – October 2025 Shore power cable replaced and entire shore power system serviced – October 2025The yacht presents in great condition and is turnkey ready. Please note the tender is not included in the asking price but is available separately.']","['DisclaimerThe Company offers the details of this vessel in good faith but cannot guarantee or warrant the accuracy of this information nor warrant the condition of the vessel. A buyer should instruct his agents, or his surveyors, to investigate such details as the buyer desires validated. This vessel is offered subject to prior sale, price change, or withdrawal without notice.']","{'Priority': '0', 'Caption': 'Azimut 60 Fly 2020 yacht cruising on blue ocean with city skyline backdrop.', 'Uri': 'https://images.boatsgroup.com/images/1/47/75/2020-azimut-60-fly-power-9964775-20251001072351337-4.jpg', 'LastModifiedDateTime': '2025-10-01T07:38:58-08:00'}",https://development.jupitermarinesales.com/search-listing/9964775
service,9852102,164990.00 USD,"{'BoatCityName': 'Townsend', 'BoatCountryID': 'US', 'BoatStateCode': 'GA'}",Regulator,2013,34 Center Console,10.92 ft,700 hp,34 ft,34 ft,"[{'Make': 'Yamaha', 'Fuel': 'unleaded', 'EnginePower': '350|horsepower', 'Type': 'Outboard 4 Stroke', 'Year': 2018, 'Hours': 1200, 'BoatEngineLocationCode': 'Port'}, {'Make': 'Yamaha', 'Fuel': 'unleaded', 'EnginePower': '350|horsepower', 'Type': 'Outboard 4 Stroke', 'Year': 2018, 'Hours': 1200, 'BoatEngineLocationCode': 'Starboard'}]","['2013 Regulator W/ Twin 2018 Yamaha 350\'s (1253 Hrs)~ 2019 Continental Triple Axle Trailer INCLUDED ~~ Always Stored in Covered Area (Trailer Kept) ~!!! Garmin Electronics !!!~ Dual Garmin Gps/Plotter/Sonar (Touch Screen) ~~ Garmin Radar ~~ Garmin Autopilot ~~ Outriggers ~~ Fusion Radio W/ JL Audio Speakers (8) ~!!! Berth W/ AC Below !!!~ Lenco Trim Tabs ~~ Curtains for Console ~~ Light Bar\xa0 (T-Top) ~~ Ship - Shore Radio (2) ~Livewells (2) 40/80 Gal~ Full Console Cover ~~ Cushioned\xa0 Forward Seating ~2 sets of engine cowlings, one set is wrapped (for looks, NO damage) other set are brand new !!!! (Wrapped set used when fishing)This vessel was wrapped for the majority of her life keeping the Gel-Coat fresh !!!The Wrap has been removed on the Hull and she shows well !!Seller says: The boat is turn key and ready to fishProfessional Opinion: Vessel is well taken care of and shows.\xa0']","['Manufacturer Provided DescriptionA true 34’ sportfisher with an exceptionally large cockpit and loaded with all the fishing features a dedicated angler would want. The Armstrong bracket allowed the designers to take back the transom so the size of the boat rivals 39’ competitors. Since the motor mounts are pushed back, you maximize deck space, plus with the bracket mounted power the 34 gets the same performance with twin engines that our competitors use triples to achieve. The combination of its proven hull, enhanced cockpit space and beam, plus overall design characteristics all work together to give Regulator a real edge in this niche.Features designed to please the discriminating angler include above deck live well, transom fishbox, walk through tuna door and optional refrigerated transom fishbox. Plus amply sized console face has room for up to two 14-inch multifunction displays. Other homerun hits include an all-fiberglass, stand-up head and dedicated berth for sleeping or storage.', 'DisclaimerThe Company, its owners, agents and brokers offer the details / descriptions of the vessels in good faith but do not guarantee, warrant or represent the accuracy of the information. Nor does the Company, its owners, agents and brokers guarantee, warrant or represent the description or condition of the vessels.All buyers should verify the description and condition of any vessel through an inspection by a qualified surveyor and mechanic.The vessels are offered subject to prior sale, price change or withdrawal without notice. The Company owners, agents and brokers makes no guarantees, representations or warranties as to title and the ability to document or register the vessel. The Company acts as a broker only and all issues as to title, documentation and registration are between the buyer and seller.', 'DisclaimerThe Company offers the details of this vessel in good faith but cannot guarantee or warrant the accuracy of this information nor warrant the condition of the vessel. A buyer should instruct his agents, or his surveyors, to investigate such details as the buyer desires validated. This vessel is offered subject to prior sale, price change, or withdrawal without notice.', 'DisclaimerThe Company offers the details of this vessel in good faith but cannot guarantee or warrant the accuracy of this information nor warrant the condition of the vessel. A buyer should instruct his agents, or his surveyors, to investigate such details as the buyer desires validated. This vessel is offered subject to prior sale, price change, or withdrawal without notice.']","{'Priority': '0', 'Caption': '2013 Regulator 34 Center Console boat on trailer, surrounded by trees.', 'Uri': 'https://images.boatsgroup.com/images/1/37/97/2013-regulator-34-center-console-power-9543797-20240914164953724-1_XLARGE.jpg', 'LastModifiedDateTime': '2025-06-25T12:06:05-08:00'}",https://development.jupitermarinesales.com/search-listing/9852102
service,9993293,539900.00 USD,"{'BoatCityName': 'St Petersburg', 'BoatCountryID': 'US', 'BoatStateCode': 'FL'}",Regulator,2024,34 Center Console,10.92 ft,300 hp,34 ft,34 ft,"[{'Make': 'YAMAHA', 'Model': 'F-300', 'DriveTransmissionDescription': 'Other', 'Fuel': 'unleaded', 'EnginePower': '300|horsepower', 'Type': 'Outboard', 'PropellerType': 'Stainless Steel', 'Year': 2024, 'Hours': 50}]","[""2024 Meticulously maintained 34' Regulator. She is a 10 and shows like new. Less than 50 hours on triple F300 Yamaha's (White) with warranty until 3/02/31. Boat was just serviced and all records are available. This boat has been cared for by an experienced owner with an open checkbook policy. DES tilt helm and DEC plus Helm Master EX Joystick w/multimode set point, EX Auto pilot w/waypoint deceleration and electronic key switch with wireless FOB, White hull, White motors, Armstrong Bracket, tackle center, upholstered helm seating, 4 cup rocket launcher, sink, washdown and bait prep station, fiberglass forward sun bed, convertible table, 12V helm air conditioning, cockpit freshwater washdown, insulated/macerated aft in deck fishbox, light bar, u/w lights, Seakeeper 2 gyro, Anchor windlass, Dual Garmin MFD's, Fantom 54 open array radar, Trolling motor.\xa0 \xa0 \xa0 \xa0 \xa0 \xa0 \xa0 \xa0 \xa0 \xa0 \xa0 \xa0 \xa0 \xa0 \xa0 \xa0 \xa0 \xa0 \xa0 \xa0 \xa0 PLEASE CONTACT DAVID COSTLEY FOR DETAILS\xa0 \xa0 \xa0 \xa0 \xa0 \xa0 \xa0 \xa0 \xa0 \xa0 \xa0 \xa0 \xa0 \xa0 \xa0 \xa0 \xa0 \xa0 \xa0 \xa0 \xa0 \xa0 \xa0 \xa0 \xa0 \xa0 \xa0 \xa0 305-283-3886""]","['Steering SystemJoystick Control', 'DisclaimerThe Company offers the details of this vessel in good faith but cannot guarantee or warrant the accuracy of this information nor warrant the condition of the vessel. A buyer should instruct his agents, or his surveyors, to investigate such details as the buyer desires validated. This vessel is offered subject to prior sale, price change, or withdrawal without notice.']","{'Priority': '0', 'Caption': '2024 Regulator 34 C boat on calm water, featuring Yamaha engines and sleek design.', 'Uri': 'https://images.boatsgroup.com/images/1/32/93/2024-regulator-34-34-c-power-9993293-20251027111050791-1.jpg', 'LastModifiedDateTime': '2025-10-27T11:26:08-08:00'}",https://development.jupitermarinesales.com/search-listing/9993293
service,9993147,215000.00 USD,"{'BoatCityName': 'Riviera Beach', 'BoatCountryID': 'US', 'BoatStateCode': 'FL'}",Four Winns,2019,H350,10.83 ft,700 hp,35 ft,35 ft,"[{'Make': 'MERCURY', 'Model': '350', 'Fuel': 'unleaded', 'EnginePower': '350|horsepower', 'Type': 'Outboard', 'Hours': 583}, {'Make': 'MERCURY', 'Model': '350', 'Fuel': 'unleaded', 'EnginePower': '350|horsepower', 'Type': 'Outboard', 'Hours': 583}]","['Now available a 2019 H350 OB Four Winns with twin 350 Mercury 4-stroke outboards. A fantastic combo bowrider/ cabin family cruising and overnight boat. There are 583 hours on these great running Mercury outboards.\xa0This 2019 Four Winns H350 OB is the large bowrider you have been looking for! \xa0She offers so much versatility as a luxurious family day boat and is perfect for weekend getaways. \xa0This vessel is absolutely loaded with all the options and provides ample seating for up to 16 guests. \xa0She is powered by twin 350 Mercury Verados( 583 hours) with Joystick control, that move her comfortably through the water at speeds of up to 50 mph. \xa0A few of the many amenities include: 5 Kw Generator , an alfresco galley(electric grill, double sink wet bar and refrigerator), large electronically multi-way powered aft sun pad/ bench seat, and a large A/C controlled interior space that includes sleeping accommodations with large windows, a full head, smart TV and microwave. \xa0 Also has dual 9\'\' Simrad EVO GPS/ fish finder screens and Simrad VHF radio. Priced to sell at $229,900. Boat is located in Riviera Beach. Contact Joe Petersen.']","['Hull and Deck Anchor line locker, w/access lid Anchor line locker, w/access lid, anchor washdown Anchor roller, bow w/stainless steel trim ring Bow and stern eyes, stainless steel Cleats, stainless steel Fiberglass stringers Hardtop, w/manual sunroof and multi-color lighting Horn Ladder, aft, angled, deep reach w/wide step pads Meets applicable ABYC, Canadian, IOS & USCG Standards, NMMA & CE certified Navigation lights Port lights, extra large curved hull windows Rub rail, rigid white vinyl w/ stainless steel insert Shower, aft, hot/cold Sky lights (2) Stable-Vee® hull Swim platform lounge Swim platform mat, espresso/teak or grey Swim platform mat, for Extended Swim espresso/teak Swim platform, aft, courtesy lights, blue Swim platform, aft, extended, low-profile Thru-hull fittings, stainless steel Transom door Windshield header, stainless steel Windshield w/ walk-thru Winning Edge Owner Protection Plan', 'Cockpit Assist handle(s), stainless steel Beverage holder(s), stainless steel Cockpit flooring, reed mat, dune or ash Cooler, carry-on w/ designated storage (n/a w/ vacu-flush) Courtesy lights Engine hatch, electric lift Fiberglass liner, self-bailing Interior, choice of Tropical Lunar, Ivory/Walnut, Latte/Dark Almond, or Lunar/Ebony Pillows, cockpit (2) Fabric Matching Seating, bow, hinged cushions Seating, double wide helm w/ flip-up bolsters Seating, L-shaped cockpit Self bailing cockpit Side panels, rich hand-fitted vinyl w/ comfort padding Storage, under seats Table w/ mount(s) Walk-thru door(s) Walk-thru transom Water intrusion management system', 'Helm Contros, dual binnacle, electronic Dash, top stitch-style detailing, precision textured trim Emergency engine shut-off Instrumentation, helm: speedometer, tachometer/hour, trim fuel, oil, depth, temp and volt gauge Instrumentation, Raymarine dual 7"" displays Instrumentation, Volvo Penta® EVC or MerCruiser® DTS Rich, hand-fitted top stitched upholstery Steering wheel, deluxe, tilt USB charge port', 'Entertainment Stereo remote at helm Stereo remote with display at transom Stereo, AM/FM/Bluetooth® Connectivity USB & MP3', 'Cabin Berth CO (carbon monoxide) monitors Fiberglass liner Head liner, easy clean Interior decor choices: neutral or mignight', 'DisclaimerThe Company offers the details of this vessel in good faith but cannot guarantee or warrant the accuracy of this information nor warrant the condition of the vessel. A buyer should instruct his agents, or his surveyors, to investigate such details as the buyer desires validated. This vessel is offered subject to prior sale, price change, or withdrawal without notice.']","{'Priority': '0', 'Caption': '2019 Four Winns H350 boat docked under a clear blue sky.', 'Uri': 'https://images.boatsgroup.com/images/1/31/47/2019-four-winns-h350-power-9993147-20251027091708725-1.jpg', 'LastModifiedDateTime': '2025-10-27T09:32:27-08:00'}",https://development.jupitermarinesales.com/search-listing/9993147
service,10002774,215000.00 USD,"{'BoatCityName': 'Riviera Beach', 'BoatCountryID': 'US', 'BoatStateCode': 'FL'}",Four Winns,2019,H350 OB,10 ft,700 hp,35 ft,35 ft,"{'0': {'Make': 'MERCURY', 'Model': '350', 'Fuel': 'unleaded', 'EnginePower': '350|horsepower', 'Type': 'Outboard', 'Hours': 583}, '1': {'Fuel': 'unleaded', 'Type': 'Outboard'}, '2': {'Make': 'MERCURY', 'Model': '350', 'Fuel': 'unleaded', 'EnginePower': '350|horsepower', 'Type': 'Outboard', 'Hours': 583}}","['Now available a 2019 H350 OB Four Winns with twin 350 Mercury 4-stroke outboards. A fantastic combo bowrider/ cabin family cruising and overnight boat. There are 583 hours on these great running Mercury outboards.\xa0This 2019 Four Winns H350 OB is the large bowrider you have been looking for! \xa0She offers so much versatility as a luxurious family day boat and is perfect for weekend getaways. \xa0This vessel is absolutely loaded with all the options and provides ample seating for up to 16 guests. \xa0She is powered by twin 350 Mercury Verados( 583 hours) with Joystick control, that move her comfortably through the water at speeds of up to 50 mph. \xa0A few of the many amenities include: 5 Kw Generator , an alfresco galley(electric grill, double sink wet bar and refrigerator), large electronically multi-way powered aft sun pad/ bench seat, and a large A/C controlled interior space that includes sleeping accommodations with large windows, a full head, smart TV and microwave. \xa0 Also has dual 9\'\' Simrad EVO GPS/ fish finder screens and Simrad VHF radio. Priced to sell at $229,900. Boat is located in Riviera Beach. Contact Joe Petersen.']","['Hull and Deck Anchor line locker, w/access lid Anchor line locker, w/access lid, anchor washdown Anchor roller, bow w/stainless steel trim ring Bow and stern eyes, stainless steel Cleats, stainless steel Fiberglass stringers Hardtop, w/manual sunroof and multi-color lighting Horn Ladder, aft, angled, deep reach w/wide step pads Meets applicable ABYC, Canadian, IOS & USCG Standards, NMMA & CE certified Navigation lights Port lights, extra large curved hull windows Rub rail, rigid white vinyl w/ stainless steel insert Shower, aft, hot/cold Sky lights (2) Stable-Vee® hull Swim platform lounge Swim platform mat, espresso/teak or grey Swim platform, aft, courtesy lights, blue Thru-hull fittings, stainless steel Transom door Windshield header, stainless steel Windshield w/ walk-thru Winning Edge Owner Protection Plan', 'Head Countertop, solid surface Fiberglass enclosed stand-up head Head, VacuFlush® w/ holding tank Power ventilation Storage, vanity', 'Cockpit Assist handle(s), stainless steel Beverage holder(s), stainless steel Cockpit flooring, reed mat, dune or ash Cooler, carry-on w/ designated storage (n/a w/ vacu-flush) Courtesy lights Fiberglass liner, self-bailing Interior, choice of Tropical Lunar, Ivory/Walnut, Latte/Dark Almond, or Lunar/Ebony Pillows, cockpit (2) Fabric Matching Seating, bow, hinged cushions Seating, double wide helm w/ flip-up bolsters Seating, L-shaped cockpit Self bailing cockpit Side panels, rich hand-fitted vinyl w/ comfort padding Storage, aft cockpit basement (OB only) Storage, under seats Table w/ mount(s) Walk-thru door(s) Walk-thru transom Water intrusion management system', 'Cabin Berth CO (carbon monoxide) monitors Fiberglass liner Head liner, easy clean Interior decor choices: neutral or mignight', 'Helm Contros, dual binnacle, electronic Dash, top stitch-style detailing, precision textured trim Emergency engine shut-off Instrumentation, helm: speedometer, tachometer/hour, trim fuel, oil, depth, temp and volt gauge Instrumentation, Raymarine dual 7"" displays Instrumentation, Volvo Penta® EVC or MerCruiser® DTS Rich, hand-fitted top stitched upholstery Steering wheel, deluxe, tilt USB charge port', 'DisclaimerThe Company offers the details of this vessel in good faith but cannot guarantee or warrant the accuracy of this information nor warrant the condition of the vessel. A buyer should instruct his agents, or his surveyors, to investigate such details as the buyer desires validated. This vessel is offered subject to prior sale, price change, or withdrawal without notice.']","{'Priority': '0', 'Caption': '2019 Four Winns H350 OB boat docked under a clear blue sky.', 'Uri': 'https://images.boatsgroup.com/images/1/27/74/2019-four-winns-h350-ob-power-10002774-20251105093549457-1.jpg', 'LastModifiedDateTime': '2025-11-05T09:50:53-08:00'}",https://development.jupitermarinesales.com/search-listing/10002774
service,9912987,1299999.00 USD,"{'BoatCityName': 'St Augustine Beach', 'BoatCountryID': 'US', 'BoatStateCode': 'FL'}",Freeman,2023,47,13.17 ft,"1,600 hp",47.17 ft,47.17 ft,"[{'Make': 'Mercury', 'Model': 'v10', 'DriveTransmissionDescription': 'Stern', 'Fuel': 'unleaded', 'EnginePower': '400|horsepower', 'Type': 'Outboard', 'Year': 2024, 'Hours': 110, 'BoatEngineLocationCode': 'Port'}, {'Make': 'Mercury', 'Model': 'v10', 'DriveTransmissionDescription': 'Stern', 'Fuel': 'unleaded', 'EnginePower': '400|horsepower', 'Type': 'Outboard', 'Year': 2024, 'Hours': 110, 'BoatEngineLocationCode': 'Center Port'}, {'Make': 'Mercury', 'Model': 'v10', 'DriveTransmissionDescription': 'Stern', 'Fuel': 'unleaded', 'EnginePower': '400|horsepower', 'Type': 'Outboard', 'Year': 2024, 'Hours': 110, 'BoatEngineLocationCode': 'Center Starboard'}, {'Make': 'Mercury', 'Model': 'v10', 'DriveTransmissionDescription': 'Stern', 'Fuel': 'unleaded', 'EnginePower': '400|horsepower', 'Type': 'Outboard', 'Year': 2024, 'Hours': 110, 'BoatEngineLocationCode': 'Starboard'}]","['This 2023 Freeman 47 delivers the perfect blend of elite offshore performance and luxurious comfort. Repowered in 2025 with the Preferred Mercury 400 V10s, it offers enhanced power, reliability, and efficiency. Meticulously maintained and Lift Kept. This vessel is in exceptional condition. Don’t miss your chance to own one of the most capable and well-cared-for Freeman 47s on the market.2023 Freeman 47 TNew Quad 400HP V10 Mercurys (110 hours) Full Factory Warranty RemainingMercury Joystick With SkyhookAmeratrail Gooseneck Trailer AvailableElectronics:(2) Simrad NS03s 24” GPSSimrad AutopilotSimrad Broadband Chirp Sounder Module1k & 3k Transducers3D SidescanSimrad NSS3s 9” Rear Facing ScreenMercury Vessel view\xa0XM Weather (Subscription Required)(2) iCom VHF RadiosFLIR Night VisionLED Light Bar 50” CurvedMulti Color Under Gunnel LED Lights(6) Electric Reel PlugsOver The Top JL Audio Package\xa0 \xa0 \xa0(2) 12” JL Subs in Bow\xa0 \xa0 \xa0(2) 8” JL Speakers in Bow\xa0 \xa0 \xa0(2) 8” JL Speakers Mid-ship\xa0 \xa0 \xa0(2) 10” JL Subs Mid-ship\xa0 \xa0 \xa0(2) 10” JL Subs Aft\xa0 \xa0 \xa0(2) 8” Speakers Aft\xa0 \xa0 \xa0 \xa0 \xa0 \xa0 \xa0 \xa0 \xa0 \xa0 \xa0 \xa0 \xa0 \xa0 \xa0 \xa0 \xa0(6) 7” JL Speakers in Top \xa0 \xa0 \xa0 \xa0 \xa0 \xa0 \xa0 \xa0 \xa0 \xa0 \xa0 \xa0 \xa0 \xa0\xa0\xa0 \xa0 \xa0 \xa0 \xa0 \xa0 \xa0 \xa0 \xa0 \xa0 \xa0 \xa0 \xa0 \xa0 \xa0 \xa0 \xa0 \xa0 \xa0 Multi Color Underwater LED Lights \xa0 \xa0 \xa0 \xa0 \xa0 \xa0 \xa0 \xa0 \xa0 \xa0 \xa0 \xa0 \xa0 \xa0 \xa0\xa0 \xa0 \xa0 Starlink\xa0Other Options:Haze Grey Hull ColorTwo Tone Grey Upholstery ColorDual Row SeatingPort & Starboard Dive DoorsDEKit KitTeak Rocket LauncherGemlux BasesMarsh Tacky 23’ OutriggersRear Facing Mezzanine SeatingLeaning Post Tackle StationKenyon Electric GrillPlumbed Electric Marine HeadFull Polycarbonate Enclosure\xa0Removable Cutting TableEdson Carbon Fiber Steering WheelZipwakePressure Mate Onboard Pressure Washer Pump(2) Removable Custom Tuna Tubes\xa0Located in Saint Augustine, Florida']","['Steering SystemJoystick Control', 'DisclaimerThe Company offers the details of this vessel in good faith but cannot guarantee or warrant the accuracy of this information nor warrant the condition of the vessel. A buyer should instruct his agents, or his surveyors, to investigate such details as the buyer desires validated. This vessel is offered subject to prior sale, price change, or withdrawal without notice.']","{'Priority': '0', 'Caption': '2023 Freeman 47 boat on calm water under a clear blue sky.', 'Uri': 'https://images.boatsgroup.com/images/1/29/87/2023-freeman-47-power-9912987-20250817092812028-3.jpg', 'LastModifiedDateTime': '2025-10-27T05:25:37-08:00'}",https://development.jupitermarinesales.com/search-listing/9912987
